{
  "schema_version": "1.0",
  "demo_only": true,
  "lesson_id": "11111111-1111-4111-8111-111111111111",
  "version_id": "22222222-2222-4222-8222-222222222222",
  "version_number": 1,
  "title": "Demo: mengenal bentuk Ba",
  "lesson_type": "listening",
  "stage_key": "demo-foundations",
  "estimated_minutes": 1,
  "source_ids": [],
  "units": [
    {
      "unit_id": "33333333-3333-4333-8333-333333333333",
      "ordinal": 1,
      "unit_type": "letter",
      "required": true,
      "instruction": "Contoh demo untuk mengenal bentuk huruf. Audio belum tersedia.",
      "letter": "ب",
      "audio_asset_id": null
    }
  ],
  "questions": []
}
